{
  "$schema": "https://json-schema.org/draft/2020-12/schema",
  "$id": "https://example.com/daily-news.schema.json",
  "title": "DailyNews daily content",
  "type": "object",
  "required": ["date", "timezone", "items"],
  "properties": {
    "date": {
      "type": "string",
      "pattern": "^\\d{4}-\\d{2}-\\d{2}$"
    },
    "timezone": {
      "type": "string"
    },
    "is_demo": {
      "type": "boolean"
    },
    "generated_at": {
      "type": "string"
    },
    "topics": {
      "type": "array",
      "items": { "type": "string" }
    },
    "cefr_level": {
      "type": "string",
      "enum": ["A1", "A2", "B1", "B2", "C1", "C2"]
    },
    "max_english_words": {
      "type": "integer",
      "minimum": 1
    },
    "items": {
      "type": "array",
      "items": {
        "type": "object",
        "required": ["id", "title", "source", "english", "chinese"],
        "properties": {
          "id": { "type": "string" },
          "title": { "type": "string" },
          "source": {
            "type": "object",
            "required": ["name"],
            "properties": {
              "name": { "type": "string" },
              "url": { "type": "string" }
            }
          },
          "english": { "type": "string" },
          "chinese": { "type": "string" },
          "keywords": {
            "type": "array",
            "items": { "type": "string" }
          },
          "audio": {
            "type": "object",
            "properties": {
              "english": { "type": "string" },
              "chinese": { "type": "string" }
            }
          },
          "subtitles": {
            "type": "object",
            "properties": {
              "english": {
                "type": "array",
                "items": { "$ref": "#/$defs/cue" }
              },
              "chinese": {
                "type": "array",
                "items": { "$ref": "#/$defs/cue" }
              }
            }
          }
        }
      }
    },
    "run_notes": {
      "type": "array",
      "items": { "type": "string" }
    }
  },
  "$defs": {
    "cue": {
      "type": "object",
      "required": ["start", "end", "text"],
      "properties": {
        "start": { "type": "number", "minimum": 0 },
        "end": { "type": "number", "minimum": 0 },
        "text": { "type": "string" }
      }
    }
  }
}
