{
  "date": "2026-06-27",
  "timezone": "Europe/Berlin",
  "is_demo": true,
  "generated_at": "2026-06-27T00:00:00+02:00",
  "topics": [
    "energy",
    "china",
    "climate"
  ],
  "cefr_level": "B2",
  "max_english_words": 80,
  "items": [
    {
      "id": "demo-001",
      "title": "China Plans More Non-Fossil Power",
      "source": {
        "name": "User-provided sample",
        "url": ""
      },
      "english": "Recent oil shocks have strengthened Beijing's resolve as it tries to balance decarbonisation efforts with securing future energy demand. China is charting an ambitious five-year plan to harness nuclear and other non-fossil sources in a bid to generate half of the country's electricity needs by 2030.",
      "chinese": "最近的石油冲击增强了北京的决心。中国正努力在推进脱碳和保障未来能源需求之间取得平衡。中国正在制定一项雄心勃勃的五年计划，希望利用核能和其他非化石能源，到2030年满足全国一半的电力需求。",
      "keywords": [
        "China",
        "energy",
        "nuclear power",
        "decarbonisation"
      ],
      "audio": {
        "english": "audio/2026-06-27/demo-001-en.mp3"
      },
      "subtitle_files": {
        "english": "audio/2026-06-27/demo-001-en.srt"
      },
      "subtitles": {
        "english": [
          {
            "start": 0.1,
            "end": 9.094,
            "text": "Recent oil shocks have strengthened Beijing's resolve as it tries to balance decarbonisation efforts with securing future energy demand."
          },
          {
            "start": 9.044,
            "end": 20.607,
            "text": "China is charting an ambitious five-year plan to harness nuclear and other non-fossil sources in a bid to generate half of the country's electricity needs by 2030."
          }
        ]
      }
    }
  ],
  "run_notes": [
    "Demo content for testing the audio and static site pipeline. Replace with Codex-generated daily news content in normal runs."
  ]
}
